{
  "schema_version": "0.2.0",
  "run_id": "gc-stability-dirty",
  "harness_version": "0.1.0",
  "generated_at": "2026-05-29T00:00:00.000Z",
  "status": "not_met",
  "profile_ref": {
    "path": "examples/profiles/gc-stability.yaml",
    "sha256": "sha256:e445a9e47c4b1dea82a03efe76f7f33c3d49330adc8fc55a96b4addf86576d18",
    "media_type": "application/yaml",
    "description": "Recurring profile."
  },
  "profile_id": "gc-stability",
  "profile_version": "0.1.0",
  "declared_capability_id": null,
  "evidence_inputs": [
    {
      "kind": "gc-evidence",
      "path": "examples/gc/findings.json",
      "sha256": "sha256:7358bf1c37953def8fe60286f05f10bd67fea565b9f5efc5de4159f09e9bdb75",
      "media_type": "application/json",
      "description": "gc-evidence evidence input."
    },
    {
      "kind": "health-result",
      "path": "examples/health/results/pass.json",
      "sha256": "sha256:1d582a68465d206b2d79faf41b92f942405928e5316a957c0691e24373178d5b",
      "media_type": "application/json",
      "description": "health-result evidence input."
    }
  ],
  "trigger_evaluation": {
    "matched": true,
    "observations": [
      {
        "metric": "gc.findings.count",
        "actual": 1,
        "comparator": "gte",
        "expected": 0,
        "matched": true
      },
      {
        "metric": "health.status",
        "actual": "passed",
        "comparator": "eq",
        "expected": "passed",
        "matched": true
      }
    ]
  },
  "stop_condition_evaluation": {
    "matched": false,
    "observations": [
      {
        "metric": "gc.findings.count",
        "actual": 1,
        "comparator": "eq",
        "expected": 0,
        "matched": false
      },
      {
        "metric": "health.status",
        "actual": "passed",
        "comparator": "eq",
        "expected": "passed",
        "matched": true
      }
    ],
    "status": "not_met",
    "clean_streak": 0
  },
  "actions_taken": [
    {
      "kind": "summary",
      "summary": {
        "status": "not_met",
        "gc_findings": 1,
        "health_status": "passed",
        "clean_streak": 0
      }
    }
  ],
  "handoff": {
    "kind": "profile-run",
    "status": "not_met",
    "next_step": "continue",
    "summary": "gc_findings=1; health_status=passed; clean_streak=0; stop_condition=not_met"
  },
  "issues": [
    {
      "code": "profile-stop-condition-not-met",
      "severity": "warning",
      "message": "gc_findings=1; health_status=passed; clean_streak=0; stop_condition=not_met"
    }
  ]
}
